{
  "$schema": "http://json-schema.org/draft-04/schema#",
  "type": "object",
  "properties": {
    "title": {
      "type": "string"
    },
    "description": {
      "type": "string"
    },
    "colors": {
      "type": "array",
      "items": {
        "type": "string"
      }
    },
    "text-field-text": {
      "type": "string"
    },
    "buy-button-text": {
      "type": "string"
    },
    "links": {
      "type": "array",
      "items": {
        "type": "object",
        "properties": {
          "text": {
            "type": "string"
          },
          "link": {
            "type": "string"
          }
        }
      }
    },
    "navigation-links": {
      "type": "array",
      "items": {
        "type": "object",
        "properties": {
          "text": {
            "type": "string"
          },
          "link": {
            "type": "string"
          }
        }
      }
    }
  }
}